message,cleaned_message,sentiment_score
wish excited prior airing honestly know anything unique appeal sparked interest first episode see decision make short going hurt impressed kind turned see next weeks episode brings maybe get ball rolling idk,wish excited prior airing honestly know anything unique appeal sparked interest first episode see decision make short going hurt impressed kind turned see next weeks episode brings maybe get ball rolling idk,0.9153
5 minutes expecting things escalate quick without explanation whatever hate though,5 minutes expecting things escalate quick without explanation whatever hate though,0.4585
ost good although like art well first episode disappointed maybe read manga,ost good although like art well first episode disappointed maybe read manga,0.5267
lol short finished episode could scroll first pages forum discussion ill give episode maybe ill stick manga,lol short finished episode could scroll first pages forum discussion ill give episode maybe ill stick manga,-0.4215
well escalated quicky horrible waiting long time looks like going back manga sure guess stick around whole series short though must hope redo w longer version something,well escalated quicky horrible waiting long time looks like going back manga sure guess stick around whole series short though must hope redo w longer version something,0.6486
hold back season avoid censoring still censored,hold back season avoid censoring still censored,-0.4215
well um studio deen animated higurashi franchise expecting bit considering nothing write home sure total watch time 1 hr going hurt maybe entice get drive find manga maybe,well um studio deen animated higurashi franchise expecting bit considering nothing write home sure total watch time 1 hr going hurt maybe entice get drive find manga maybe,-0.5043
art cool first episode extremely stupid since 5 minutes episode might well keep watching,art cool first episode extremely stupid since 5 minutes episode might well keep watching,-0.0754
begins complete shit yeah great idea,begins complete shit yeah great idea,0.4019
laughed might keep watching since 5 minutes get 1 10,laughed might keep watching since 5 minutes get 1 10,0.4588
already knew gonna bad short wow wtf 3 mins enough horror anime,already knew gonna bad short wow wtf 3 mins enough horror anime,-0.802
actually terrible understand five minutes long animation style lacking much seem like something studio deen would mention anime flow well disjointed felt though dialogue explanation happened ending event mention kinda ends little lead ending ends cuts straight ending based first episode way turn well horror anime attempted 5 minutes per episode really liked ending song though opening much enjoy ending,actually terrible understand five minutes long animation style lacking much seem like something studio deen would mention anime flow well disjointed felt though dialogue explanation happened ending event mention kinda ends little lead ending ends cuts straight ending based first episode way turn well horror anime attempted 5 minutes per episode really liked ending song though opening much enjoy ending,0.3804
pupa pupa pupa good expected,pupa pupa pupa good expected,0.4404
even,even,0.0
wait 12 episodes maybe bad anime damn hell watch,wait 12 episodes maybe bad anime damn hell watch,-0.8957
sovietcong said well um studio deen animated higurashi franchise expecting bit considering nothing write home sure total watch time 1 hr going hurt maybe entice get drive find manga maybe problem without op ed 36 minutes story 1 hour,sovietcong said well um studio deen animated higurashi franchise expecting bit considering nothing write home sure total watch time 1 hr going hurt maybe entice get drive find manga maybe problem without op ed 36 minutes story 1 hour,-0.7151
cried,cried,-0.3818
really like op ed opinion really much hope anime,really like op ed opinion really much hope anime,0.7159
first episode much detail manga far first episode vague read first would confused,first episode much detail manga far first episode vague read first would confused,-0.4019
rather 3 full length episodes bunch short ones story manga already weak episode length ruins effect really think horror anime would work well short series,rather 3 full length episodes bunch short ones story manga already weak episode length ruins effect really think horror anime would work well short series,-0.8261
adaptation bad started laughting loud seriously expect,adaptation bad started laughting loud seriously expect,-0.6369
gosh despondent episode like wtf 1 minute anime rest music show transformer like want hated episode,gosh despondent episode like wtf 1 minute anime rest music show transformer like want hated episode,-0.7783
truly masterpice shit 5 fucking mins gag anime funny,truly masterpice shit 5 fucking mins gag anime funny,-0.1226
hilarious show went 8 6 officially aired lol,hilarious show went 8 6 officially aired lol,0.6705
short length working say airing tv either censoring bad job pupa bad job,short length working say airing tv either censoring bad job pupa bad job,-0.7906
little disappointed short! much potential turn cult classic kill lays eggs!,little disappointed short! much potential turn cult classic kill lays eggs!,-0.8439
fuck !,fuck !,-0.5848
damn censoreship really big deal mean come think air everything tv straight point wtf fucking minutes fucks sake make 24 minute episode felt rushed like art style though,damn censoreship really big deal mean come think air everything tv straight point wtf fucking minutes fucks sake make 24 minute episode felt rushed like art style though,-0.7564
shittyyyyy,shittyyyyy,0.0
lolwut,lolwut,0.0
sort liked wondering brother marks face arms problem censoring wow whole two seconds censorship boycott deen like censored removed blood scene hell blood everywhere even spraying onto screen even fucking dog censored exploded like watching tv getting mad bleep word fuck,sort liked wondering brother marks face arms problem censoring wow whole two seconds censorship boycott deen like censored removed blood scene hell blood everywhere even spraying onto screen even fucking dog censored exploded like watching tv getting mad bleep word fuck,-0.7845
nabris said wondering brother marks face arms probably sort demon,nabris said wondering brother marks face arms probably sort demon,0.0
nope expected 5 minutes 3mins minus op ed non sol comedy shows work shorts watch couple episodes see wether turns better hopes really slim,nope expected 5 minutes 3mins minus op ed non sol comedy shows work shorts watch couple episodes see wether turns better hopes really slim,0.802
op ed dark also ost censored best part,op ed dark also ost censored best part,0.5574
usually love short anime one bad lacks something never thought would say short anime lol,usually love short anime one bad lacks something never thought would say short anime lol,0.5423
fuck actual fuck,fuck actual fuck,-0.7906
like da dog cute next sec like ewwwwwwwwwwwww das gross synopsis seems like story would like watch,like da dog cute next sec like ewwwwwwwwwwwww das gross synopsis seems like story would like watch,0.836
creepy show shit wtf,creepy show shit wtf,-0.8126
whats going 0____0 revert back,whats going 0____0 revert back,0.0
bad orz read manga would lost hell likely follow rather watch whole thing marathon ends,bad orz read manga would lost hell likely follow rather watch whole thing marathon ends,-0.886
fuck watch shittiest manga adaptation ever,fuck watch shittiest manga adaptation ever,-0.836
shit whole purpose show crudelty creepy feel censoring fun go read manga least censorships kids lady tells go away see red butterflies say open dice said disappointing thing 2013 first disappointing thing 2014,shit whole purpose show crudelty creepy feel censoring fun go read manga least censorships kids lady tells go away see red butterflies say open dice said disappointing thing 2013 first disappointing thing 2014,-0.7717
god fucking dammit waited long grotesque horror anime something huge fan manga something almost never get anime four minutes long censored shit actually read manga feel like potential know four fucking minutes long censored shit mean still watch see goes four motherfucking minutes long huge waste time also minute saw dog first thought holy shit! thing!,god fucking dammit waited long grotesque horror anime something huge fan manga something almost never get anime four minutes long censored shit actually read manga feel like potential know four fucking minutes long censored shit mean still watch see goes four motherfucking minutes long huge waste time also minute saw dog first thought holy shit! thing!,-0.937
facepalm show strength muster beyond obvious somewhere production stalled airing unfinished piece shit beyond upset actually time actually excited creepy anime anime version class hollywood film memory poster shout fuck ten times get across god damn displeasure fuck fuck fuck fuck fuck fuck fuck fuck fuck fuck,facepalm show strength muster beyond obvious somewhere production stalled airing unfinished piece shit beyond upset actually time actually excited creepy anime anime version class hollywood film memory poster shout fuck ten times get across god damn displeasure fuck fuck fuck fuck fuck fuck fuck fuck fuck fuck,-0.9915
nabris said sort liked wondering brother marks face arms problem censoring wow whole two seconds censorship boycott deen like censored removed blood scene hell blood everywhere even spraying onto screen even fucking dog censored exploded like watching tv getting mad bleep word fuck dude kidding right censored important scenes episode people said adapted poorly story flow animation bad art k 1 positive thing art,nabris said sort liked wondering brother marks face arms problem censoring wow whole two seconds censorship boycott deen like censored removed blood scene hell blood everywhere even spraying onto screen even fucking dog censored exploded like watching tv getting mad bleep word fuck dude kidding right censored important scenes episode people said adapted poorly story flow animation bad art k 1 positive thing art,-0.7351
sourire said nabris said sort liked wondering brother marks face arms problem censoring wow whole two seconds censorship boycott deen like censored removed blood scene hell blood everywhere even spraying onto screen even fucking dog censored exploded like watching tv getting mad bleep word fuck dude kidding right censored important scenes episode people said adapted poorly story flow animation bad art k 1 positive thing art adaptation bad rushed ton loved big bro got like full 10 secs screen time manga hogs panels chapter 1 main problem source material sucked,sourire said nabris said sort liked wondering brother marks face arms problem censoring wow whole two seconds censorship boycott deen like censored removed blood scene hell blood everywhere even spraying onto screen even fucking dog censored exploded like watching tv getting mad bleep word fuck dude kidding right censored important scenes episode people said adapted poorly story flow animation bad art k 1 positive thing art adaptation bad rushed ton loved big bro got like full 10 secs screen time manga hogs panels chapter 1 main problem source material sucked,-0.8402
nabris said sort liked wondering brother marks face arms lol see people mean say bad adaption guess put spoiler covered initial transformation scene father heavily abused given reason protective sister,nabris said sort liked wondering brother marks face arms lol see people mean say bad adaption guess put spoiler covered initial transformation scene father heavily abused given reason protective sister,-0.296
fucking creeped long time monster reminded bit ctcd episode king ramses ghost holy tater tots,fucking creeped long time monster reminded bit ctcd episode king ramses ghost holy tater tots,-0.3182
omfgaaawhd weirdest shit ive seen year! heard ppl actually high hopes know better lmao censored gore part even release trash 1 5,omfgaaawhd weirdest shit ive seen year! heard ppl actually high hopes know better lmao censored gore part even release trash 1 5,0.5848
bad expecting,bad expecting,-0.5423
well sucked shame short censored hell point watching damn hyped first announced rarely say save time read manga,well sucked shame short censored hell point watching damn hyped first announced rarely say save time read manga,-0.9385
,,0.0
pretty sure everyone feels let episodes 5 mins long knew still seems like shock watching,pretty sure everyone feels let episodes 5 mins long knew still seems like shock watching,0.6597
well reading manga chapter episode say minutes enough first chapter manga 10 10 skipped lot important scenes used heavily censored hope fix everything next episode otherwise would really sad thing,well reading manga chapter episode say minutes enough first chapter manga 10 10 skipped lot important scenes used heavily censored hope fix everything next episode otherwise would really sad thing,0.204
holy shit score dropped 10 points since posted 17 minutes ago,holy shit score dropped 10 points since posted 17 minutes ago,-0.5574
actual fuck like seriously,actual fuck like seriously,-0.4019
wow dat animation monster going haunt dreams guaranteed pretty creepy interested seeing going,wow dat animation monster going haunt dreams guaranteed pretty creepy interested seeing going,0.8658
open dice said disappointing thing 2013 first disappointing thing 2014 koroshiya san beat 2013 department opinion 3 mins take op ed,open dice said disappointing thing 2013 first disappointing thing 2014 koroshiya san beat 2013 department opinion 3 mins take op ed,-0.7506
trash,trash,0.0
know feel,know feel,0.0
isnt disappointing something disappointing implies ever potential first place,isnt disappointing something disappointing implies ever potential first place,0.6435
one anime looking forward along strange saw news strange getting season already short really really dissappointing,one anime looking forward along strange saw news strange getting season already short really really dissappointing,-0.3818
manga guys yeah go read pretend happen yeah good day,manga guys yeah go read pretend happen yeah good day,0.7096
holy hell even,holy hell even,-0.6808
watching score anime drop pretty frickin hilariou kami_no_kage said manga guys yeah go read pretend happen yeah good day funny thing bad,watching score anime drop pretty frickin hilariou kami_no_kage said manga guys yeah go read pretend happen yeah good day funny thing bad,0.7506
kami_no_kage said manga guys yeah go read pretend happen yeah good day manga bad cupquake said watching score anime drop pretty frickin hilariou kami_no_kage said manga guys yeah go read pretend happen yeah good day funny thing badsee got ninjaed thats bad,kami_no_kage said manga guys yeah go read pretend happen yeah good day manga bad cupquake said watching score anime drop pretty frickin hilariou kami_no_kage said manga guys yeah go read pretend happen yeah good day funny thing badsee got ninjaed thats bad,0.8316
already expecing censorship 5mins x 12eps bet end vol,already expecing censorship 5mins x 12eps bet end vol,0.0
really anticipating anime bad manga much better,really anticipating anime bad manga much better,-0.2177
one actually enjoyed first episode one 5 min episode people judging like worst anime planet even read manga wait til next episode next week,one actually enjoyed first episode one 5 min episode people judging like worst anime planet even read manga wait til next episode next week,0.1779
demi_v said one actually enjoyed first episode one 5 min episode people judging like worst anime planet even read manga wait til next episode next week lot us judging read manga bad watched anime worse,demi_v said one actually enjoyed first episode one 5 min episode people judging like worst anime planet even read manga wait til next episode next week lot us judging read manga bad watched anime worse,-0.7096
would lot better longer put censoring series mainly gore,would lot better longer put censoring series mainly gore,0.4404
pretty broing expected,pretty broing expected,0.4939
censoring four minute episodes even know bothered think people desperate anime worthwhile,censoring four minute episodes even know bothered think people desperate anime worthwhile,-0.296
know nothing manga feeling going another 1 10 trainwreck abandoning ship,know nothing manga feeling going another 1 10 trainwreck abandoning ship,-0.4534
wow clue everybody excited maybe horror thing,wow clue everybody excited maybe horror thing,0.3612
really mind pretty good storyline cant say much characters cuz read manga pc admit something worth watching got minutes day making wait long,really mind pretty good storyline cant say much characters cuz read manga pc admit something worth watching got minutes day making wait long,0.8534
dat low budget dem wtf studio deen make anime hakkenden style budgeted,dat low budget dem wtf studio deen make anime hakkenden style budgeted,-0.7096
episode 1 previewed screening aeon cinema makuhari shintoshin chiba prefecture december 21 2013 regular broadcasting begin january 10 2014 imagine people felt preview cinema xd,episode 1 previewed screening aeon cinema makuhari shintoshin chiba prefecture december 21 2013 regular broadcasting begin january 10 2014 imagine people felt preview cinema xd,0.5859
cupquake said demi_v said one actually enjoyed first episode one 5 min episode people judging like worst anime planet even read manga wait til next episode next week lot us judging read manga bad watched anime worse point coming repeatedly talk bad manga definitely worse anime yeah think making 5 min long mistake far kind disappointing one episode people already completely condemning chill guys,cupquake said demi_v said one actually enjoyed first episode one 5 min episode people judging like worst anime planet even read manga wait til next episode next week lot us judging read manga bad watched anime worse point coming repeatedly talk bad manga definitely worse anime yeah think making 5 min long mistake far kind disappointing one episode people already completely condemning chill guys,-0.8689
hell lame,hell lame,-0.8126
enjoyed minutes hard really say anything good bad worst thing far minutes shame,enjoyed minutes hard really say anything good bad worst thing far minutes shame,-0.6845
least red butterflies pretty look at! count something maybe think,least red butterflies pretty look at! count something maybe think,0.5411
well kind crappy continue bit though,well kind crappy continue bit though,0.2263
hated everything wrote review pupa btw,hated everything wrote review pupa btw,-0.6369
bastek66 said anyone expectations shit idiot mean world idiot,bastek66 said anyone expectations shit idiot mean world idiot,-0.8807
urmmm creepy mixed feeling story interesting anime want see like ed though,urmmm creepy mixed feeling story interesting anime want see like ed though,0.7184
complaining length wait whole thing released treat hour long film even intended way maybe probably enjoyable least going watch series actually judging contents first episode usually big fan horror thought horror elements kind lame cute things exploding turning scary really idea good horror think series potential like said watch finished airing one sitting,complaining length wait whole thing released treat hour long film even intended way maybe probably enjoyable least going watch series actually judging contents first episode usually big fan horror thought horror elements kind lame cute things exploding turning scary really idea good horror think series potential like said watch finished airing one sitting,0.0202
myq said complaining length wait whole thing released treat hour long film even intended way maybe probably enjoyable least going watch series actually judging contents first episode usually big fan horror thought horror elements kind lame cute things exploding turning scary really idea good horror think series potential like said watch finished airing one sitting point exactly announced length episode advance see people complaining first episode things bound unravel next 11 episodes simple,myq said complaining length wait whole thing released treat hour long film even intended way maybe probably enjoyable least going watch series actually judging contents first episode usually big fan horror thought horror elements kind lame cute things exploding turning scary really idea good horror think series potential like said watch finished airing one sitting point exactly announced length episode advance see people complaining first episode things bound unravel next 11 episodes simple,-0.1832
way short orz,way short orz,0.0
well short depressing rather gross think pass one,well short depressing rather gross think pass one,-0.5574
bastek66 said anyone expectations shit idiot pretty much save slight talking slight still terrible either way bit face animate interactions father faithfully guy one worst parents history manga,bastek66 said anyone expectations shit idiot pretty much save slight talking slight still terrible either way bit face animate interactions father faithfully guy one worst parents history manga,-0.7096
5 minutes loss words,5 minutes loss words,-0.3182
disappointed censoring still mind continuing though lloved op ed might well pick manga,disappointed censoring still mind continuing though lloved op ed might well pick manga,-0.25
even cares censored fucking short get anything short 5 minute anime pointless gets,even cares censored fucking short get anything short 5 minute anime pointless gets,0.34
well f expected wait expect anything f anyway dat crappy backgrounds 5 min episodes censoring exactly pushed back anyway,well f expected wait expect anything f anyway dat crappy backgrounds 5 min episodes censoring exactly pushed back anyway,-0.3612
tengoku_no_hakai said well f expected wait expect anything f anyway dat crappy backgrounds 5 min episodes censoring exactly pushed back anyway wondering fuck dat censoring hell dude wearing hair clip,tengoku_no_hakai said well f expected wait expect anything f anyway dat crappy backgrounds 5 min episodes censoring exactly pushed back anyway wondering fuck dat censoring hell dude wearing hair clip,-0.891
people think messed please read first chapter manga shallow crappy anime,people think messed please read first chapter manga shallow crappy anime,-0.5719
solvitesekai said people think messed please read first chapter manga shallow crappy anime least first chapter manga made go oooh made go mehhh,solvitesekai said people think messed please read first chapter manga shallow crappy anime least first chapter manga made go oooh made go mehhh,-0.5719
alinet86 said urmmm creepy mixed feeling story interesting anime want see like ough story story,alinet86 said urmmm creepy mixed feeling story interesting anime want see like ough story story,0.7184
xchee said solvitesekai said people think messed please read first chapter manga shallow crappy anime least first chapter manga made go oooh made go mehhh xchee said solvitesekai said people think messed please read first chapter manga shallow crappy anime least first chapter manga made go oooh made go mehhh manga bunch poorly defined copy paste characters gore drawn make people feel sexually aroused anime poorly drawn sack shit gore drawn make people sexually aroused swear amount people clearly know general idea pupa somehow upset anime exactly trash manga astounding honestly see nigh 1 1 adaptation thing cut like 10 pages dad beating kids mc talking much loves sister wrapped still father anime plot wise thats needed blame studio deen blame shit mangaka fact people watch anything long theres blood lolicon shit,xchee said solvitesekai said people think messed please read first chapter manga shallow crappy anime least first chapter manga made go oooh made go mehhh xchee said solvitesekai said people think messed please read first chapter manga shallow crappy anime least first chapter manga made go oooh made go mehhh manga bunch poorly defined copy paste characters gore drawn make people feel sexually aroused anime poorly drawn sack shit gore drawn make people sexually aroused swear amount people clearly know general idea pupa somehow upset anime exactly trash manga astounding honestly see nigh 1 1 adaptation thing cut like 10 pages dad beating kids mc talking much loves sister wrapped still father anime plot wise thats needed blame studio deen blame shit mangaka fact people watch anything long theres blood lolicon shit,-0.9201
well weird feel anything watched sexually aroused far,well weird feel anything watched sexually aroused far,0.1027
horror series meant scare core problem people seem think simply gore screen flimsy slightly unsettling plot makes series horror approach plot sexually driven comical way ceases horror,horror series meant scare core problem people seem think simply gore screen flimsy slightly unsettling plot makes series horror approach plot sexually driven comical way ceases horror,-0.9517
wait really meant guro fanservice thought inside joke like people call free gay,wait really meant guro fanservice thought inside joke like people call free gay,0.7906
